step,route,action,body,status
PATH-01,IHE IT Infrastructure,Prepare profile/work-item proposal,IHE ITI Planning Committee,draft pathway
PATH-02,IHE IT Infrastructure,Technical scoping and detailed supplement/profile text,IHE ITI Technical Committee,draft pathway
PATH-03,IHE IT Infrastructure,Resolve BALP derivation or mapping,IHE ITI/BALP editors external validation required,requires-confirmation
PATH-04,HL7 parallel route,Consider FHIR IG project proposal,HL7 Security Work Group / FHIR Infrastructure external validation required,requires-confirmation
PATH-05,EU alignment,Coordinate EHDS-facing interpretation,HL7 Europe or national FHIR governance external validation required,future
